id,title,dis,com,htype,rty,fit,flo,sumflo,pri,lab
1462,阳光100国际新城 ,惠山区,天一新城,2室1厅,整租,中等装修,9,11层,1700,《U房置业实拍》阳光壹佰居家装修二房，家具家电齐全可随时看房
1463,唐明园 ,新吴区,鸿山,2室2厅,整租,精装修,2,6层,1200,唐明园精装两室2厅家具家电全留 靠近学校 镇政府 看房方便
1464,华府庄园白金府邸 ,惠山区,惠山新城,3室2厅,整租,精装修,2,26层,2500,华府庄园，全新装修，从未住过，小三房，拎包入住
1465,世家名门 ,滨湖区,太湖新城,1室1厅,整租,精装修,12,32层,1400,万象城旁世家名门精装公寓 甜美温馨 设施齐全 紧靠东降街
1466,映月华府 ,锡山区,安镇,2室2厅,整租,精装修,8,19层,2000,映月华府2房出租精装修，拎包入住，交通便利，环境好，随时看房
1467,盛岸二村 ,梁溪区,山北,1室2厅,整租,精装修,2,6层,800,精装修市区10min新的一套近蓉湖新村惠华新村蓉湖壹号
1468,富羊花苑 ,锡山区,羊尖,3室2厅,整租,毛坯,3,6层,800,富羊花苑毛坯三房，房间空间大，可以做饭有钥匙可随时看房！
1469,周新苑(三期) ,滨湖区,太湖新城,2室2厅,整租,精装修,14,28层,1800,周新苑精装两房 华润万家海岸城旁 家具家电齐全 随时看 可刀
1470,塘南新村 ,梁溪区,清名桥,3室1厅,整租,精装修,4,6层,1800,塘南新村 精装三房 靠近日航酒店 靠近南禅寺 南长街
1471,瑞成花园南区 ,新吴区,江溪,3室2厅,整租,精装修,4,18层,2500,新之城、春 潮花园附近，瑞城国际，精装小三房，拎包入住
1472,风顺里 ,梁溪区,江海,3室2厅,整租,精装修,3,7层,1500,好房分享！学前路风顺里精品三房 配备齐全 温馨舒适 班车必经
1473,欧典家园 ,新吴区,长江路,3室2厅,整租,豪华装修,11,28层,2000,长江路 欧尚超市 欧典家园 豪装三房 价格便宜 交通方便
1474,风华里小区 ,梁溪区,南禅寺,2室2厅,整租,精装修,4,7层,1600,风华里精装2房 南禅寺附近 学前东路旁 出行方便
1475,万科金域缇香东区 ,新吴区,江溪,3室2厅,整租,精装修,14,34层,3200,万科金域缇香 豪华精装大三房（婚房，房东住了半年不到）包物业
1476,天鹅湖花园A区 ,滨湖区,太湖新城,2室1厅,整租,精装修,15,24层,2600,天鹅湖精装两房 南北通透 温馨舒适 近江大 地铁口 拎包入住
1477,黄巷新村 ,梁溪区,黄巷,2室1厅,整租,精装修,3,7层,1000,金太湖欧风街商圈黄巷新村精装两房出租，家电齐全，拎包入住
1478,冠达豪景东苑 ,锡山区,安镇,3室2厅,整租,精装修,5,9层,200,锡东高铁站地铁口精装三房安镇中学旁冠达豪景东苑
1479,太湖花园二区 ,新吴区,长江路,2室1厅,整租,精装修,3,6层,1600,太湖花园 房东自租房 你与朋友理想的好房子 舒适整洁便宜！
1480,世贸首府 ,梁溪区,北大街,2室1厅,整租,精装修,8,45层,2200,火车站旁 世贸小区 温馨舒适 精装两房 拎包入住 交通便利
1481,太湖国际社区香缇美郡 ,滨湖区,太湖新城,2室2厅,整租,精装修,12,18层,2000,太湖国际精致两房 干净清爽 全新家具家电 配套成熟紧靠万象城
1482,春雷嘉苑 ,新吴区,长江路,3室2厅,整租,精装修,2,6层,1800,新区春雷家园 超值三房  南北通透  采光好 看房方便
1483,东风家园 ,梁溪区,江海,2室2厅,整租,精装修,18,28层,1800,东风家园 精装两房 配套齐全 装修好 可押一付一 拎包入住
1484,周新苑(五期) ,滨湖区,太湖新城,2室2厅,整租,精装修,10,24层,1600,《千家万沪实拍》周新苑5期 自住装修2房 家电齐全 近海岸城
1485,金科中心 ,梁溪区,江海,3室2厅,整租,精装修,20,32层,3500,金科中心  全屋地暖 新装修 从未入住 *出租
1486,渔港家园B区 ,滨湖区,梅园,2室1厅,整租,中等装修,2,11层,1300,渔港家园 中装两房 交通方便 家具家电齐全 拎包入住 风景区
1487,春江花园A区 ,锡山区,东亭,3室2厅,整租,中等装修,4,6层,2700,春江花园一期清爽三房 设施齐全 真实照片
1488,阳光壹佰 ,惠山区,天一新城,2室1厅,整租,精装修,33,33层,1800,《U房置业实拍》阳光100精装二房 超高性价比 居家必选
1489,奕淳公寓(一期) ,新吴区,长江路,3室2厅,整租,精装修,15,28层,2800,长江绿岛一期精装三房 家具齐全 全地暖 出行便利 品质社区！
1490,润泽雅居 ,新吴区,旺庄,3室1厅,整租,精装修,16,32层,800,润泽雅居大单间出租 带独立卫生间 家电全新 宝龙旁边！
1491,广瑞二村南区 ,梁溪区,广丰,2室1厅,整租,精装修,3,6层,1500,广瑞路 广瑞二村精装修两房繁华地段设施齐全拎包入住
1492,荷花里 ,梁溪区,北大街,1室2厅,整租,精装修,4,8层,1600,北大街荷花里 1室2厅55平米 精装修 押一付三
1493,溪南新村南区 ,滨湖区,河埒口,2室1厅,合租,精装修,3,7层,1000,溪南新村 精装2房 拎包入住
1494,新丰苑西区 ,新吴区,江溪,2室1厅,整租,精装修,3,6层,1100,新区 坊前中学 坊前农贸市场新丰苑两室 领包入住 环境优美
1495,水乡苑二区 ,滨湖区,太湖新城,2室1厅,整租,中等装修,1,12层,1500,水乡苑二区 两房出租 拎包入住
1496,新光小区 ,锡山区,东亭,2室2厅,整租,精装修,3,6层,1500,新光小区 干净清爽 精装2室 家电齐全 采光充足 拎包入住
1497,天鹅湖熙园三期 ,滨湖区,太湖新城,2室2厅,整租,精装修,2,11层,2400,育英旁天鹅湖熙园精装两房 干净清爽 位置优越紧靠地铁
1498,瑞雪家园 ,滨湖区,太湖新城,2室1厅,整租,精装修,30,33层,1500,瑞雪家园精装两房家电齐全拎包入住
1499,融禾花苑 ,梁溪区,上马墩,2室2厅,整租,精装修,22,33层,3500,火车站酒吧街附近 圆融广场 新装2房 含物业
1500,融创花溪美墅(三期) ,滨湖区,太湖新城,2室2厅,整租,精装修,10,27层,2500,江大地铁口 融创熙园 豪装通透大三房出租 房东急租 随时看房
1501,金锡苑南区 ,锡山区,东亭,2室1厅,整租,精装修,5,7层,1500,金锡苑 桑达园 柏木南苑精装两房 柏庄地铁口 出门超市菜场
1502,协信未来城 ,梁溪区,山北,3室1厅,整租,中等装修,11,34层,1850,山北菜场旁协信未来城新装三房诚心出租 拎包入住
1503,名园 ,惠山区,惠山新城,3室2厅,整租,精装修,4,6层,2000,名园精装三房，2000/月，陪读好选择
1504,太湖国际社区星辉塞纳 ,滨湖区,太湖新城,2室2厅,整租,精装修,28,45层,2350,太湖国际，精装两房，靠近湖 离万象城无锡大剧院也特别近
1505,兴竹家园 ,梁溪区,江海,1室1厅,整租,精装修,10,18层,1300,新区 长江路 兴竹家园精装修一室一厅 设施齐全 交通方便 急
1506,周新苑(五期) ,滨湖区,太湖新城,2室2厅,整租,精装修,15,22层,1500,《千家万沪实拍》周新苑5期 精装2房 家电齐全 拎包入住
1507,前进花园A区 ,新吴区,长江路,1室0厅,合租,精装修,2,6层,750,前进花园 两室一厅合租！要求单身 爱干净
1508,新城尚东雅园 ,新吴区,旺庄,3室2厅,整租,精装修,11,32层,4500,新城尚东雅园，环境优美，商场超市银行等基础设施齐全。
1509,阳光城市花园C区 ,梁溪区,金星,3室2厅,整租,精装修,4,24层,4200,阳光城市花园C区145平三房拎包入住 配套齐全 出行方便
1510,万科金域蓝湾 ,滨湖区,河埒口,3室2厅,整租,精装修,16,30层,4000,万科金域蓝湾精装三房家具家电齐全拎包入住有钥匙随时看
1511,无锡碧桂园东区 ,锡山区,安镇,2室2厅,整租,精装修,18,26层,2000,入住适合陪读两室，采光好，通风好，家电齐全，随时看房
1512,大箕山家园(南区) ,滨湖区,梅园,2室1厅,整租,精装修,3,11层,1200,大箕山租房  四周围山 环境优美 空调家电齐全 拎包入住
1513,上马墩一村 ,梁溪区,上马墩,2室2厅,整租,精装修,3,7层,1300,上马墩路 地铁精装两房 交通便利 设施齐全 采光无敌拎包入住
1514,住友家园 ,滨湖区,河埒口,2室2厅,整租,精装修,5,35层,2000,新住友家园 荷叶孙蒋新村旁 家具家电齐全 拎包入住 看房随时
1515,天鹅湖熙园三期 ,滨湖区,太湖新城,2室2厅,整租,精装修,12,27层,2400,天鹅湖精装两房 近江大科技园 交通便利 随时看房 拎包即可住
1516,沁园新村 ,梁溪区,清名桥,2室1厅,整租,精装修,4,6层,2500,沁园新村 茂业附近 中介费五折 仅限一天 地铁口 交通便利
1517,东风家园 ,梁溪区,江海,2室1厅,整租,精装修,10,32层,1900,长江北路东风家园精装电梯两房  采光好户型佳 随时拎包入住
1518,太湖国际社区拾壹峰 ,滨湖区,太湖新城,2室2厅,整租,精装修,14,18层,3200,太湖国际自住两房 南北通透 包物业费 近万象城 博大 大剧院
1519,红星紫郡 ,锡山区,东亭,2室2厅,整租,精装修,14,33层,1600,义诚好房，红星紫郡精装2房，采光好，随时看房，家电全齐，急租
1520,湖滨南苑 ,滨湖区,河埒口,2室2厅,整租,精装修,5,7层,2000,工业设计院旁湖滨南苑精装自住两房出租房源真实欲租从速
1521,孙蒋新村南区 ,滨湖区,河埒口,2室1厅,整租,中等装修,4,7层,1500,大润发附近，孙蒋新村，两室一厅，两房朝南，双阳台，随时看房
1522,绿城玉兰花园一期 ,滨湖区,太湖新城,3室2厅,整租,豪华装修,15,23层,12000,绿城玉兰花园一期精装房 配套齐全房东诚心出租采光极好拎包入住
1523,瑞城花园北区 ,新吴区,江溪,3室2厅,整租,豪华装修,6,10层,4500,瑞城国际豪华装修三房两厅两卫家电设施全拎包入住整租
1524,中大诺卡小镇 ,锡山区,东亭,2室2厅,整租,毛坯,10,18层,1400,义诚好房！诺卡小镇三期，精装南北两房，业主之前自住，价格美丽
1525,春潮花园三区西区 ,新吴区,江溪,2室2厅,整租,精装修,3,6层,1550,紧邻小区门口处公交站台 之前婚装 房东许诺5年内不涨房租
1526,蠡湖香樟园南区 ,滨湖区,蠡湖新城,4室2厅,整租,精装修,11,30层,15000,蠡湖 映山伴水湖景一线房 蠡湖香璋园 豪华四房 可卖可租
1527,杨木桥小区 ,梁溪区,黄巷,2室1厅,整租,精装修,2,6层,1600,五河四小区 精装修 整租
1528,华仁凤凰城 ,梁溪区,北大街,2室2厅,整租,精装修,8,32层,2700,华仁凤凰城中层精装两房，租金便宜，拎包入住，晚了就没了
1529,爱家金河湾 ,梁溪区,广丰,3室2厅,整租,豪华装修,13,29层,5000,爱家金河湾 豪装3房 实木家具家电 中央空调 拎包入住
1530,洛城水韵园 ,惠山区,洛社,3室2厅,整租,中等装修,1,6层,2800,水韵花园，花园洋房，超大客厅，一梯两户，干净整洁
1531,南湖家园北区 ,滨湖区,太湖新城,3室1厅,整租,精装修,1,11层,1800,南湖家园精装三房 出了门就是D铁口 性价比高！
1532,春合苑北区 ,锡山区,东亭,2室1厅,整租,精装修,4,6层,1600,义诚好房！地铁口易买得旁春合苑老式精装拎包入住 交通便利
1533,蠡湖香樟园北区 ,滨湖区,蠡湖新城,4室2厅,整租,精装修,26,31层,30000,蠡湖香樟园豪装四房 自住装修 南北通透 全天采光周边空气清新
1534,泰伯花苑一区 ,新吴区,梅村,1室1厅,合租,精装修,1,6层,650,泰伯花苑精装三房出租一室房子干净整洁采光通风不错靠近五洲国际
1535,建乐家园A区(51-61) ,梁溪区,金星,2室2厅,整租,精装修,20,33层,1500,金星建乐家园 2室2厅88平米 精装修 押一付三
1536,叙丰家园 ,新吴区,长江路,2室1厅,整租,毛坯,3,7层,1500,《U房置业实拍》叙丰家园精装2房 东西齐全 这价格还等什么呢
1537,仁和英伦皇家花园南区 ,梁溪区,山北,3室2厅,整租,精装修,4,6层,2600,盛岸路百乐广场仁和花园精装3房 拎包住性价比高出租急租中
1538,颐和湾公寓 ,梁溪区,北大街,2室2厅,整租,精装修,10,20层,2800,中大颐和湾精装两房 沃尔玛北大街莲蓉苑嘉德附近
1539,万科金域缇香 ,新吴区,长江路,3室2厅,整租,精装修,21,32层,4100,长江北路欧尚旁地铁口万科金域缇香精装拎包入住高档小区安全性高
1540,长江国际雅园 ,新吴区,长江路,4室2厅,整租,精装修,5,9层,8000,复式豪装公寓 豪华落地窗南北通透 电梯直接入户超大观景阳台
1541,周潭佳园(贡湖苑73-93号) ,滨湖区,太湖新城,2室2厅,整租,精装修,12,33层,1400,贡湖苑精装两房家电齐全可拎包入住周边环境舒适
1542,胜利新村 ,滨湖区,河埒口,3室1厅,合租,中等装修,4,7层,1550,胜利新村  万达旁 中装小三房 靠近路边 随时看房 房东诚售
1543,魅力万科城一区 ,滨湖区,太湖新城,3室2厅,整租,豪华装修,31,32层,3500,U房置业实拍魅力万科一期 欧式两房 随时看房 品牌装修
1544,魅力万科城酩悦 ,滨湖区,太湖新城,1室1厅,整租,精装修,18,32层,1800,低.价抢.租万科酩悦房子不会让你白跑
1545,水秀新村(溪东路) ,滨湖区,河埒口,2室1厅,整租,精装修,4,7层,1800,水秀精装两房 家电齐全  拎包入住 出门公交站 交通便利
1546,益明苑 ,梁溪区,上马墩,3室2厅,整租,中等装修,11,17层,3450,益明苑，邻近中央车站 三房中等装修设施齐全房东诚心出租
1547,春城家园 ,新吴区,江溪,1室1厅,整租,精装修,27,33层,1100,新区 春城家园 1室精装 拎包入住 户型方正 朝南 采光好
1548,世家名门 ,滨湖区,太湖新城,1室1厅,整租,精装修,9,18层,1550,世家名门 精装一房 朝南户型 干净整洁 近东绛 万象城 华润
1549,叙康里南区 ,新吴区,长江路,2室1厅,整租,精装修,4,7层,1300,《U房置业实拍》叙康里 精装两房 价格低 家电齐全 拎包住
1550,新欧风花园 ,梁溪区,北大街,2室2厅,整租,精装修,12,32层,2500,实拍欧风新天地精装2房 拎包入住采光好近地铁 近沃尔玛 急租
1551,香梅人家 ,新吴区,梅村,1室1厅,整租,毛坯,6,18层,800,香梅人家精装修一室出租 家电齐全 交通购物方便 看房提前联系
1552,奕淳公寓(二期) ,新吴区,长江路,3室2厅,整租,精装修,12,32层,3000,长江北路 奕淳公寓(二期) 真实房源 家电齐全 拎包入住！
1553,叙康里北区 ,新吴区,长江路,2室1厅,整租,精装修,5,18层,1500,新区叙康里 精装2房欧尚超市附近 周边配套齐全 交通便利
1554,禾嘉国际 ,梁溪区,北大街,1室1厅,整租,精装修,15,34层,1500,押一付一！！胜利门地铁口禾嘉温馨公寓 装修给力 走路酒吧街
1555,金科新大陆 ,梁溪区,广益,1室1厅,整租,精装修,13,25层,1700,京东广场金科新大陆精装一室 温馨舒适 配套齐全 拎包入住
1556,魅力万科城二区 ,滨湖区,太湖新城,3室2厅,整租,精装修,7,9层,2800,魅力万科之城温馨三房 小区中庭无遮挡 近天鹅湖 太湖国际育红
1557,万科金域缇香 ,新吴区,长江路,2室2厅,整租,豪华装修,15,30层,3000,长江北路地铁1号线欧尚对面 金域缇香婚装两室 拎包即住
1558,绿地波士顿公馆 ,惠山区,惠山新城,2室2厅,整租,精装修,12,18层,1600,绿地2房精装，省锡中对面，周边万达，乐购，地铁1号线，急租！
1559,宝龙国际公寓 ,新吴区,长江路,1室1厅,整租,精装修,12,25层,1150,旺庄、长江路宝龙单身公寓，复式挑高，可办公、居住，注 册公司
1560,瑞雪家园 ,滨湖区,太湖新城,3室2厅,整租,精装修,9,15层,1400,瑞雪家园精装3房 南北通透 全天采光 配套齐全 拎包入住
1561,瑞雪家园 ,滨湖区,太湖新城,2室1厅,整租,精装修,23,32层,1300,瑞雪家园精装两房家电齐全拎包入住
1562,东风家园 ,梁溪区,江海,2室1厅,整租,精装修,10,26层,1900,东风家园 长江北路 精装两房 采光很好 看房随时 家电齐全
1563,新城尚东雅园 ,新吴区,旺庄,2室2厅,整租,精装修,15,34层,2800,急租 急租长江北路宝龙超市对面尚东雅园精装2房 家具家电齐全
1564,香山名园 ,新吴区,旺庄,1室1厅,整租,精装修,21,33层,1500,长江北路 香山名园 拎包入住 价格实惠 1室1厅 采光好
1565,陈家岸新村 ,惠山区,钱桥,2室2厅,整租,中等装修,3,4层,1300,出租 陈家岸新村   百乐后面   交通便利  靠近玉泉街
1566,新梁溪人家 ,滨湖区,河埒口,1室1厅,整租,精装修,8,14层,1500,新体旁单身公寓诚心出租 设施齐全 交通方便
1567,香雪苑 ,滨湖区,梅园,2室1厅,整租,精装修,5,6层,1300,香雪苑精装两房 交通便利 生活设施齐全 看房随时管社山家园
1568,新安花苑一区 ,新吴区,新安,2室1厅,整租,精装修,8,18层,1500,新安花苑一区两房出租，朝阳采光好，临近公交站台和超市，随看房
1569,风雷新村 ,梁溪区,上马墩,2室1厅,整租,精装修,3,7层,1500,风雷新村温馨两房 靠地铁口市中心家电齐全拎包入住干净清爽
1570,金城新村 ,梁溪区,金星,2室1厅,整租,中等装修,2,6层,1100,芦庄四区，旁边芦庄菜场，附近中，联新村，金城新村，新乐苑旁边
1571,长江国际花园 ,新吴区,长江路,4室2厅,整租,精装修,5,5层,4200,长江国际花园 顶复大四房 家电家具齐全翻新装修 外籍高管首租
1572,长江大厦 ,新吴区,旺庄,1室1厅,整租,精装修,18,32层,1750,地铁口 长江大厦 精装舒适1房 1750拎包入住 赶快行动！
1573,沁园新村 ,梁溪区,清名桥,1室0厅,合租,精装修,1,15层,1300,沁园新村精装修单身公寓出租近茂业百货地铁沿线
1574,宁海里小区 ,梁溪区,上马墩,1室1厅,整租,精装修,3,7层,900,宁海里 精装一房 交通便利 紧邻市区 生活配套全 看房方便
1575,蓝庭国际一期 ,滨湖区,河埒口,2室2厅,整租,豪华装修,6,16层,2500,高档小区蓝庭国际豪装2房新体对面，近家乐福近奥林花园！
1576,万科金域缇香 ,新吴区,长江路,3室2厅,整租,精装修,22,34层,4500,缇香 大三房 22楼 采光好 诚心租
1577,广瑞三村 ,梁溪区,广丰,2室1厅,整租,精装修,3,6层,1200,广瑞大润发旁 精装一房 广瑞三村 拎包入住 家电齐全 采光好
1578,长江国际花园 ,新吴区,长江路,1室2厅,整租,精装修,3,6层,1700,假日广场对面 长江国际花园精装单间 拎包入住 好房 看房随时
1579,东风家园 ,梁溪区,江海,2室2厅,整租,精装修,10,31层,1700,新区东风家园精装两房交通便利大统华旁地铁口
1580,兴竹家园 ,梁溪区,江海,2室2厅,整租,精装修,5,18层,1450,新区欧尚旁兴竹家园精装两房繁华地段拎包入住生活出行便利
1581,轻院小区 ,梁溪区,黄巷,2室1厅,整租,精装修,4,6层,1300,轻院小区 两房全新装修 户型超好 101医院旁 拎包入住
1582,长江金岸（长江大厦） ,锡山区,东亭,1室1厅,整租,精装修,26,33层,2000,新区长江金岸（长江大厦）品质房期待你的到来
1583,怡东雅苑 ,锡山区,安镇,3室2厅,整租,精装修,3,28层,2000,怡东雅苑   精装三房 看房方便  环境优美 大润发商圈！
1584,嘉德时代广场 ,梁溪区,迎龙桥,1室1厅,整租,精装修,16,17层,1500,嘉德广场精装爱情公寓 近地铁口 三阳广场 楼层好采光佳拎包住
1585,五河新村 ,梁溪区,黄巷,2室1厅,整租,精装修,3,6层,1200,欧风街沿线，凤翔高架，家乐福超市，五河新村，清爽装修两房
1586,落霞苑第二社区 ,滨湖区,太湖新城,2室2厅,整租,精装修,3,6层,1350,落霞苑精装两室，近南湖家园地铁口，外国语学校，塘铁桥，好房！
1587,香山名园 ,新吴区,旺庄,1室1厅,整租,毛坯,12,32层,1300,长江路香山名园单身公寓，家电齐全，融智大厦、新区科技园旁
1588,太湖花园二区 ,新吴区,长江路,3室2厅,整租,精装修,3,7层,1800,太湖花园二期 精装三房 初次出租 家电齐 1800/月 急租
1589,保利香槟国际 ,滨湖区,太湖新城,2室2厅,整租,精装修,4,18层,2500,《U房置业实拍》保利香槟国际精装两房！近万科！万象城！诚租！
1590,融创熙园(一期) ,滨湖区,太湖新城,3室2厅,整租,毛坯,6,28层,3200,新出！江南大学融创熙园3房精装全配拎包入住3200/月包物业
1591,金洋奥澜 ,惠山区,惠山新城,1室1厅,整租,毛坯,1,2层,28000,地铁口旁住宅底沿街商铺，可做轻餐饮、生活服务生意，目前只出售
1592,嘉禾现代城 ,梁溪区,上马墩,3室2厅,整租,精装修,7,16层,5000,U房置业实拍市中心嘉禾现代城精装3房家电齐全诚租
1593,南湖家园北区 ,滨湖区,太湖新城,2室2厅,整租,豪华装修,17,18层,2000,南湖家园 温馨自住两室 好房急租 看房随时 性价比超高仅一套
1594,梁湖南苑 ,滨湖区,河埒口,2室1厅,整租,精装修,8,11层,1300,荣巷地铁口 梁湖南苑 精装两房 家电齐全 拎包入住 随时看房
1595,南星苑三区 ,新吴区,硕放,3室1厅,整租,精装修,3,6层,1600,南星苑 精装大两房 家电家具齐全 出门厂车 钥匙在店 随时看
1596,阳光城市花园B区 ,梁溪区,金星,1室1厅,整租,精装修,7,32层,2200,《有家肥仔》9.3发阳光城市花园7楼单间精装全配2200
1597,金惠苑 ,惠山区,惠山新城,2室1厅,整租,精装修,4,6层,1600,金惠园小区对面省锡中全新装修精装2房南北通透高中陪读家访方便
1598,华盛苑 ,滨湖区,太湖新城,3室2厅,整租,精装修,13,33层,2000,华盛苑精装三房出租 家电家具齐全 拎包入住 房东诚心出租
1599,梨南苑 ,梁溪区,黄巷,2室1厅,整租,中等装修,2,6层,1800,《房置业实拍》梨南苑两房1800出租，家电齐全，拎包入住！
1600,万科金域缇香 ,新吴区,长江路,2室2厅,整租,精装修,15,32层,2800,万科金域缇香高端小区，适合外国人，高管居住，全新装修，包物业
1601,明发国际新城东区 ,惠山区,天一新城,2室2厅,整租,精装修,8,18层,2100,《U房置业实拍》明发国际精装两房 全新装修看房方便有钥匙
1602,太湖国际社区拾壹峰 ,滨湖区,太湖新城,2室2厅,整租,精装修,16,18层,2500,太湖国际精装两房，自住装修，近万象城商业街 靠万科城市花园
1603,金科观天下 ,梁溪区,上马墩,2室2厅,整租,精装修,17,31层,1800,地铁房金科观天下 温馨大两房 采光无敌 环境优雅 交通便利
1604,万科金域缇香 ,新吴区,长江路,3室2厅,整租,豪华装修,20,32层,5000,万科金域缇香豪装三房家具家电齐全随时看房诚心出租
1605,荷花里 ,梁溪区,北大街,3室1厅,整租,精装修,6,7层,2000,荷花里精装修三房非顶楼员工宿舍还等什么！近T12北大街
1606,东风家园 ,梁溪区,江海,2室1厅,整租,精装修,19,34层,1800,好房分享 东风家园 豪装两室 欧尚超市旁 班车必经 拎包入住
1607,紫金英郡 ,滨湖区,河埒口,2室2厅,整租,精装修,2,17层,2600,紫金英郡精装两房 高档小 近万达 临大润发 沿地铁 拎包入住
1608,民丰里小区 ,梁溪区,黄巷,1室1厅,合租,简单装修,3,6层,1400,房东诚意出租本房源，周边配套齐全，
1609,苏宁雅悦国际公寓 ,梁溪区,崇安寺,2室2厅,整租,豪华装修,35,52层,9000,市中心三阳百盛旁 苏宁广场简明欧式豪装两房 照片实拍
1610,金科观天下 ,梁溪区,上马墩,2室2厅,整租,简单装修,16,32层,2300,崇安区上马墩金科观天下婚装两房急租性价比高
1611,明发国际新城东区 ,惠山区,天一新城,3室2厅,整租,精装修,6,16层,600,《U房置业实拍》阳光100精装两房楼层好户型正房。随时看房。
1612,奕淳公寓(三期) ,新吴区,长江路,2室2厅,整租,精装修,21,33层,3800,长江路上长江绿岛2室2厅 精装修 家电齐全 干净清爽
1613,阳光100国际新城 ,惠山区,天一新城,2室1厅,整租,中等装修,6,15层,1500,急租阳光100阿尔勒好房型 中等装修 即租即入住
1614,天鹅湖熙园二期 ,滨湖区,太湖新城,4室2厅,合租,精装修,14,18层,800,《U房实拍》熙园精装合租房 靠地铁 家具齐全 拎包入住
1615,翠园新村 ,梁溪区,清名桥,1室1厅,整租,精装修,1,6层,900,翠园新村1房精装南北通透交通方便家电齐全拎包入住
1616,元一蔚蓝观邸 ,梁溪区,黄巷,2室2厅,整租,精装修,15,33层,3000,u房置业实拍 蔚蓝观邸 精装3房 家具家电齐全 拎包入住
1617,泰伯花苑二区 ,新吴区,梅村,2室1厅,整租,精装修,4,6层,1600,泰伯花苑新出精装修两房，家电齐全，一手房源干净整洁适合一家人
1618,天鹅湖花园A区 ,滨湖区,太湖新城,3室2厅,整租,中等装修,2,24层,2800,天鹅湖A区三居室 近地铁口 包物业 看房方便
1619,尤渡苑二期 ,梁溪区,上马墩,3室2厅,整租,精装修,9,11层,2300,尤渡苑精装3房，配套齐全，业主急租 华东商贸城宁海里旁
1620,理想城市花园 ,惠山区,惠山新城,2室2厅,整租,精装修,8,24层,1800,理想城市花园，精装2+1户型，户型好，采光好，房东诚心出租
1621,金科新大陆 ,梁溪区,广益,1室1厅,整租,精装修,16,34层,1750,广益哥伦布对面 金科新大陆 单身公寓急租 随时看房
1622,映月华府 ,锡山区,安镇,2室2厅,整租,精装修,8,19层,2000,映月华府2房出租精装修，拎包入住，交通便利，环境好，随时看房
1623,香缤公寓 ,梁溪区,广益,1室1厅,整租,精装修,25,26层,1350,崇安广益路香缤公寓单身公寓稀.缺一室一厅朝南采光很好家电齐全
